00:00.0 0600: 8086:1237 (rev 02)
	Subsystem: 1af4:1100
	Control: I/O+ Mem+ BusMaster- SpecCycle- MemWINV- VGASnoop- ParErr- Stepping- SERR+ FastB2B- DisINTx-
	Status: Cap- 66MHz- UDF- FastB2B- ParErr- DEVSEL=fast >TAbort- <TAbort- <MAbort- >SERR- <PERR- INTx-

00:01.0 0601: 8086:7000
	Subsystem: 1af4:1100
	Control: I/O+ Mem+ BusMaster- SpecCycle- MemWINV- VGASnoop- ParErr- Stepping- SERR+ FastB2B- DisINTx-
	Status: Cap- 66MHz- UDF- FastB2B- ParErr- DEVSEL=medium >TAbort- <TAbort- <MAbort- >SERR- <PERR- INTx-

00:01.1 0101: 8086:7010 (prog-if 80 [ISA Compatibility mode-only controller, supports bus mastering])
	Subsystem: 1af4:1100
	Control: I/O+ Mem+ BusMaster+ SpecCycle- MemWINV- VGASnoop- ParErr- Stepping- SERR+ FastB2B- DisINTx-
	Status: Cap- 66MHz- UDF- FastB2B+ ParErr- DEVSEL=medium >TAbort- <TAbort- <MAbort- >SERR- <PERR- INTx-
	Latency: 0
	Region 0: Memory at 000001f0 (32-bit, non-prefetchable) [virtual] [size=8]
	Region 1: Memory at 000003f0 (type 3, non-prefetchable) [virtual]
	Region 2: Memory at 00000170 (32-bit, non-prefetchable) [virtual] [size=8]
	Region 3: Memory at 00000370 (type 3, non-prefetchable) [virtual]
	Region 4: I/O ports at c0e0 [virtual] [size=16]
	Kernel driver in use: ata_piix
	Kernel modules: ata_piix, ata_generic

00:01.2 0c03: 8086:7020 (rev 01) (prog-if 00 [UHCI])
	Subsystem: 1af4:1100
	Control: I/O+ Mem+ BusMaster+ SpecCycle- MemWINV- VGASnoop- ParErr- Stepping- SERR+ FastB2B- DisINTx-
	Status: Cap- 66MHz- UDF- FastB2B- ParErr- DEVSEL=fast >TAbort- <TAbort- <MAbort- >SERR- <PERR- INTx-
	Latency: 0
	Interrupt: pin D routed to IRQ 11
	Region 4: I/O ports at c080 [size=32]
	Kernel driver in use: uhci_hcd

00:01.3 0680: 8086:7113 (rev 03)
	Subsystem: 1af4:1100
	Control: I/O+ Mem+ BusMaster- SpecCycle- MemWINV- VGASnoop- ParErr- Stepping- SERR+ FastB2B- DisINTx-
	Status: Cap- 66MHz- UDF- FastB2B+ ParErr- DEVSEL=medium >TAbort- <TAbort- <MAbort- >SERR- <PERR- INTx-
	Interrupt: pin A routed to IRQ 9
	Kernel driver in use: piix4_smbus
	Kernel modules: i2c_piix4

00:02.0 0300: 1af4:1050 (rev 01) (prog-if 00 [VGA controller])
	Subsystem: 1af4:1100
	Control: I/O+ Mem+ BusMaster+ SpecCycle- MemWINV- VGASnoop- ParErr- Stepping- SERR+ FastB2B- DisINTx+
	Status: Cap+ 66MHz- UDF- FastB2B- ParErr- DEVSEL=fast >TAbort- <TAbort- <MAbort- >SERR- <PERR- INTx-
	Latency: 0
	Interrupt: pin A routed to IRQ 10
	Region 0: Memory at fe000000 (32-bit, prefetchable) [size=8M]
	Region 2: Memory at fe800000 (64-bit, prefetchable) [size=16K]
	Region 4: Memory at febd0000 (32-bit, non-prefetchable) [size=4K]
	Expansion ROM at 000c0000 [disabled] [size=128K]
	Capabilities: <access denied>
	Kernel driver in use: virtio-pci

00:03.0 0200: 1af4:1000
	Subsystem: 1af4:0001
	Physical Slot: 3
	Control: I/O+ Mem+ BusMaster+ SpecCycle- MemWINV- VGASnoop- ParErr- Stepping- SERR+ FastB2B- DisINTx+
	Status: Cap+ 66MHz- UDF- FastB2B- ParErr- DEVSEL=fast >TAbort- <TAbort- <MAbort- >SERR- <PERR- INTx-
	Latency: 0
	Interrupt: pin A routed to IRQ 11
	Region 0: I/O ports at c000 [size=64]
	Region 1: Memory at febd1000 (32-bit, non-prefetchable) [size=4K]
	Region 4: Memory at fe804000 (64-bit, prefetchable) [size=16K]
	Expansion ROM at feb80000 [disabled] [size=256K]
	Capabilities: <access denied>
	Kernel driver in use: virtio-pci

00:04.0 0100: 1af4:1001
	Subsystem: 1af4:0002
	Physical Slot: 4
	Control: I/O+ Mem+ BusMaster+ SpecCycle- MemWINV- VGASnoop- ParErr- Stepping- SERR+ FastB2B- DisINTx+
	Status: Cap+ 66MHz- UDF- FastB2B- ParErr- DEVSEL=fast >TAbort- <TAbort- <MAbort- >SERR- <PERR- INTx-
	Latency: 0
	Interrupt: pin A routed to IRQ 11
	Region 0: I/O ports at c040 [size=64]
	Region 1: Memory at febd2000 (32-bit, non-prefetchable) [size=4K]
	Region 4: Memory at fe808000 (64-bit, prefetchable) [size=16K]
	Capabilities: <access denied>
	Kernel driver in use: virtio-pci

00:05.0 00ff: 1af4:1002
	Subsystem: 1af4:0005
	Physical Slot: 5
	Control: I/O+ Mem+ BusMaster+ SpecCycle- MemWINV- VGASnoop- ParErr- Stepping- SERR+ FastB2B- DisINTx-
	Status: Cap+ 66MHz- UDF- FastB2B- ParErr- DEVSEL=fast >TAbort- <TAbort- <MAbort- >SERR- <PERR- INTx-
	Latency: 0
	Interrupt: pin A routed to IRQ 10
	Region 0: I/O ports at c0a0 [size=32]
	Region 4: Memory at fe80c000 (64-bit, prefetchable) [size=16K]
	Capabilities: <access denied>
	Kernel driver in use: virtio-pci

00:06.0 00ff: 1af4:1005
	Subsystem: 1af4:0004
	Physical Slot: 6
	Control: I/O+ Mem+ BusMaster+ SpecCycle- MemWINV- VGASnoop- ParErr- Stepping- SERR+ FastB2B- DisINTx-
	Status: Cap+ 66MHz- UDF- FastB2B- ParErr- DEVSEL=fast >TAbort- <TAbort- <MAbort- >SERR- <PERR- INTx-
	Latency: 0
	Interrupt: pin A routed to IRQ 10
	Region 0: I/O ports at c0c0 [size=32]
	Region 4: Memory at fe810000 (64-bit, prefetchable) [size=16K]
	Capabilities: <access denied>
	Kernel driver in use: virtio-pci

00:07.0 0100: 1af4:1001
	Subsystem: 1af4:0002
	Physical Slot: 7
	Control: I/O+ Mem+ BusMaster+ SpecCycle- MemWINV- VGASnoop- ParErr- Stepping- SERR- FastB2B- DisINTx+
	Status: Cap+ 66MHz- UDF- FastB2B- ParErr- DEVSEL=fast >TAbort- <TAbort- <MAbort- >SERR- <PERR- INTx-
	Latency: 0
	Interrupt: pin A routed to IRQ 11
	Region 0: I/O ports at 1000 [size=64]
	Region 1: Memory at c0000000 (32-bit, non-prefetchable) [size=4K]
	Region 4: Memory at 440000000 (64-bit, prefetchable) [size=16K]
	Capabilities: <access denied>
	Kernel driver in use: virtio-pci
